{
  "$schema": "https://json-schema.org/draft/2020-12/schema",
  "$id": "urn:uuid:1966bb29-5717-478e-8363-0b7b22fc220b",
  "title": "TripContract",
  "type": "object",
  "additionalProperties": false,
  "required": [
    "schemaVersion",
    "id",
    "title",
    "country",
    "currency",
    "locale",
    "startDate",
    "endDate",
    "travelers",
    "services",
    "dependencies",
    "overnightExemptions"
  ],
  "properties": {
    "schemaVersion": {
      "const": "1.0.0"
    },
    "id": {
      "type": "string",
      "format": "uuid"
    },
    "title": {
      "type": "string",
      "minLength": 1,
      "maxLength": 160
    },
    "country": {
      "type": "string",
      "pattern": "^[A-Z]{2}$"
    },
    "currency": {
      "type": "string",
      "pattern": "^[A-Z]{3}$"
    },
    "locale": {
      "type": "string",
      "minLength": 2,
      "maxLength": 64,
      "pattern": "^[A-Za-z]{2,8}(?:-[A-Za-z0-9]{1,8}){0,12}$"
    },
    "startDate": {
      "type": "string",
      "format": "date"
    },
    "endDate": {
      "type": "string",
      "format": "date"
    },
    "travelers": {
      "type": "array",
      "maxItems": 30,
      "items": {
        "$ref": "#/$defs/traveler"
      }
    },
    "services": {
      "type": "array",
      "maxItems": 200,
      "items": {
        "$ref": "#/$defs/service"
      }
    },
    "dependencies": {
      "type": "array",
      "maxItems": 200,
      "items": {
        "$ref": "#/$defs/dependency"
      }
    },
    "overnightExemptions": {
      "type": "array",
      "maxItems": 366,
      "items": {
        "type": "object",
        "additionalProperties": false,
        "required": [
          "date",
          "reason"
        ],
        "properties": {
          "date": {
            "type": "string",
            "format": "date"
          },
          "reason": {
            "type": "string",
            "minLength": 3,
            "maxLength": 300
          }
        }
      }
    }
  },
  "$defs": {
    "traveler": {
      "type": "object",
      "additionalProperties": false,
      "required": [
        "id",
        "label",
        "ageGroup",
        "needs"
      ],
      "properties": {
        "id": {
          "type": "string",
          "minLength": 1,
          "maxLength": 80
        },
        "label": {
          "type": "string",
          "minLength": 1,
          "maxLength": 80
        },
        "ageGroup": {
          "enum": [
            "infant",
            "child",
            "adult",
            "senior",
            "undisclosed"
          ]
        },
        "needs": {
          "type": "array",
          "maxItems": 20,
          "uniqueItems": true,
          "items": {
            "enum": [
              "step_free",
              "child_seat",
              "stroller",
              "crib",
              "quiet_breaks",
              "dietary",
              "assistance",
              "other"
            ]
          }
        }
      }
    },
    "time": {
      "type": "object",
      "additionalProperties": false,
      "required": [
        "local",
        "timeZone"
      ],
      "properties": {
        "local": {
          "type": "string",
          "pattern": "^\\d{4}-\\d{2}-\\d{2}T\\d{2}:\\d{2}$"
        },
        "timeZone": {
          "type": [
            "string",
            "null"
          ],
          "maxLength": 80
        }
      }
    },
    "money": {
      "type": "object",
      "additionalProperties": false,
      "required": [
        "currency",
        "baseMinor",
        "fees",
        "totalMinor"
      ],
      "properties": {
        "currency": {
          "type": "string",
          "pattern": "^[A-Z]{3}$"
        },
        "baseMinor": {
          "type": "integer",
          "minimum": 0,
          "maximum": 9000000000000
        },
        "fees": {
          "type": "array",
          "maxItems": 40,
          "items": {
            "type": "object",
            "additionalProperties": false,
            "required": [
              "label",
              "amountMinor"
            ],
            "properties": {
              "label": {
                "type": "string",
                "minLength": 1,
                "maxLength": 120
              },
              "amountMinor": {
                "type": "integer",
                "minimum": 0,
                "maximum": 9000000000000
              }
            }
          }
        },
        "totalMinor": {
          "type": "integer",
          "minimum": 0,
          "maximum": 9000000000000
        }
      }
    },
    "service": {
      "type": "object",
      "additionalProperties": false,
      "required": [
        "id",
        "kind",
        "title",
        "country",
        "provider",
        "reservation",
        "start",
        "end",
        "price",
        "cancellation",
        "baggage",
        "documentIds",
        "requirements"
      ],
      "properties": {
        "id": {
          "type": "string",
          "minLength": 1,
          "maxLength": 80
        },
        "kind": {
          "enum": [
            "flight",
            "bus",
            "hotel",
            "rental_home",
            "activity",
            "car_rental",
            "insurance",
            "transfer",
            "rail",
            "ferry",
            "cruise",
            "hostel",
            "camping",
            "homestay",
            "taxi",
            "rideshare",
            "bicycle",
            "walking",
            "campervan",
            "event",
            "coworking"
          ]
        },
        "title": {
          "type": "string",
          "minLength": 1,
          "maxLength": 200
        },
        "country": {
          "type": "string",
          "pattern": "^[A-Z]{2}$"
        },
        "regulatoryScope": {
          "enum": [
            "br_air_transport",
            "br_interstate_regular_bus",
            "other",
            "unknown"
          ]
        },
        "provider": {
          "type": "object",
          "additionalProperties": false,
          "required": [
            "name",
            "category",
            "registration",
            "contact"
          ],
          "properties": {
            "name": {
              "type": "string",
              "minLength": 1,
              "maxLength": 160
            },
            "category": {
              "enum": [
                "airline",
                "bus_operator",
                "hotel",
                "rental_host",
                "agency",
                "tour_operator",
                "guide",
                "car_rental",
                "insurer",
                "other",
                "rail_operator",
                "ferry_operator",
                "cruise_operator",
                "campground",
                "hostel",
                "transfer_operator",
                "venue",
                "coworking"
              ]
            },
            "registration": {
              "type": "object",
              "additionalProperties": false,
              "required": [
                "scheme",
                "value",
                "status",
                "sourceUrl",
                "checkedAt"
              ],
              "properties": {
                "scheme": {
                  "type": [
                    "string",
                    "null"
                  ],
                  "maxLength": 40
                },
                "value": {
                  "type": [
                    "string",
                    "null"
                  ],
                  "maxLength": 80
                },
                "status": {
                  "enum": [
                    "unknown",
                    "active",
                    "inactive",
                    "not_applicable"
                  ]
                },
                "sourceUrl": {
                  "type": [
                    "string",
                    "null"
                  ],
                  "maxLength": 2000
                },
                "checkedAt": {
                  "type": [
                    "string",
                    "null"
                  ],
                  "format": "date-time"
                }
              }
            },
            "cadastur": {
              "type": "object",
              "additionalProperties": false,
              "required": [
                "applicability",
                "status",
                "sourceUrl",
                "checkedAt"
              ],
              "properties": {
                "applicability": {
                  "enum": [
                    "required",
                    "optional",
                    "not_applicable",
                    "unknown"
                  ]
                },
                "status": {
                  "enum": [
                    "unknown",
                    "active",
                    "inactive",
                    "not_applicable"
                  ]
                },
                "sourceUrl": {
                  "type": [
                    "string",
                    "null"
                  ],
                  "maxLength": 2000
                },
                "checkedAt": {
                  "type": [
                    "string",
                    "null"
                  ],
                  "format": "date-time"
                }
              }
            },
            "contact": {
              "type": [
                "string",
                "null"
              ],
              "maxLength": 300
            }
          }
        },
        "reservation": {
          "type": "object",
          "additionalProperties": false,
          "required": [
            "state",
            "reference",
            "confirmation",
            "confirmationDocumentId",
            "paymentChannel"
          ],
          "properties": {
            "state": {
              "enum": [
                "quote",
                "booked",
                "cancelled",
                "completed"
              ]
            },
            "reference": {
              "type": [
                "string",
                "null"
              ],
              "maxLength": 100
            },
            "confirmation": {
              "enum": [
                "not_checked",
                "confirmed",
                "failed"
              ]
            },
            "confirmationDocumentId": {
              "type": [
                "string",
                "null"
              ],
              "format": "uuid"
            },
            "paymentChannel": {
              "enum": [
                "unknown",
                "platform",
                "direct",
                "outside_agreed_channel"
              ]
            }
          }
        },
        "start": {
          "$ref": "#/$defs/time"
        },
        "end": {
          "$ref": "#/$defs/time"
        },
        "location": {
          "type": [
            "string",
            "null"
          ],
          "maxLength": 500
        },
        "price": {
          "oneOf": [
            {
              "$ref": "#/$defs/money"
            },
            {
              "type": "null"
            }
          ]
        },
        "cancellation": {
          "type": "object",
          "additionalProperties": false,
          "required": [
            "summary",
            "deadline",
            "documentId"
          ],
          "properties": {
            "summary": {
              "type": [
                "string",
                "null"
              ],
              "maxLength": 4000
            },
            "deadline": {
              "type": [
                "string",
                "null"
              ],
              "format": "date-time"
            },
            "documentId": {
              "type": [
                "string",
                "null"
              ],
              "format": "uuid"
            }
          }
        },
        "baggage": {
          "type": [
            "string",
            "null"
          ],
          "maxLength": 2000
        },
        "documentIds": {
          "type": "array",
          "maxItems": 100,
          "uniqueItems": true,
          "items": {
            "type": "string",
            "format": "uuid"
          }
        },
        "fieldSources": {
          "type": "object",
          "additionalProperties": false,
          "properties": {
            "reservation.reference": {
              "type": "string",
              "format": "uuid"
            },
            "cancellation.summary": {
              "type": "string",
              "format": "uuid"
            },
            "baggage": {
              "type": "string",
              "format": "uuid"
            }
          }
        },
        "requirements": {
          "type": "array",
          "maxItems": 30,
          "items": {
            "type": "object",
            "additionalProperties": false,
            "required": [
              "code",
              "status"
            ],
            "properties": {
              "code": {
                "type": "string",
                "minLength": 1,
                "maxLength": 80
              },
              "status": {
                "enum": [
                  "unknown",
                  "confirmed",
                  "unavailable"
                ]
              }
            }
          }
        },
        "jurisdictions": {
          "type": "array",
          "maxItems": 16,
          "uniqueItems": true,
          "items": {
            "type": "string",
            "pattern": "^[A-Z]{2}$"
          }
        }
      }
    },
    "dependency": {
      "type": "object",
      "additionalProperties": false,
      "required": [
        "from",
        "to",
        "minimumMinutes",
        "basis"
      ],
      "properties": {
        "from": {
          "type": "string",
          "maxLength": 80
        },
        "to": {
          "type": "string",
          "maxLength": 80
        },
        "minimumMinutes": {
          "type": "integer",
          "minimum": 0,
          "maximum": 2880
        },
        "basis": {
          "enum": [
            "traveler_preference",
            "provider_policy",
            "operational_assumption"
          ]
        }
      }
    }
  }
}
